{"$comment":"Canonical parsing additionally requires the four guard paths to be pairwise case-insensitively distinct and non-ancestor under Windows path semantics.","$defs":{"identity":{"additionalProperties":false,"properties":{"byte_count":{"maximum":2147483647,"minimum":1,"type":"integer"},"sha256":{"not":{"const":"0000000000000000000000000000000000000000000000000000000000000000"},"pattern":"^[0-9a-f]{64}$","type":"string"}},"required":["byte_count","sha256"],"type":"object"},"path":{"allOf":[{"pattern":"^[A-Za-z]:\\\\[^<>:%\"/\\\\|?*\\u0000-\\u001f]+(?:\\\\[^<>:%\"/\\\\|?*\\u0000-\\u001f]+)*$"},{"not":{"pattern":"[ .](?:\\\\|$)"}},{"not":{"pattern":"(?:^|\\\\)\\."}},{"not":{"pattern":"(?:^|\\\\)(?:[Cc][Oo][Nn]|[Pp][Rr][Nn]|[Aa][Uu][Xx]|[Nn][Uu][Ll]|[Cc][Ll][Oo][Cc][Kk]\\$|[Cc][Oo][Nn][Ii][Nn]\\$|[Cc][Oo][Nn][Oo][Uu][Tt]\\$|[Cc][Oo][Mm][1-9]|[Ll][Pp][Tt][1-9])[ ]*(?:\\.[^\\\\]*)?(?:\\\\|$)"}},{"pattern":"^[\\u0000-\\u007f]+$"}],"maxLength":260,"minLength":3,"type":"string"}},"$schema":"https://json-schema.org/draft/2020-12/schema","additionalProperties":false,"properties":{"expected_identities":{"additionalProperties":false,"properties":{"controller":{"$ref":"#/$defs/identity"},"locked_preflight":{"$ref":"#/$defs/identity"},"supervisor":{"$ref":"#/$defs/identity"},"timeout_child":{"$ref":"#/$defs/identity"},"timeout_root":{"$ref":"#/$defs/identity"},"ui_fixture":{"$ref":"#/$defs/identity"}},"required":["controller","locked_preflight","supervisor","timeout_child","timeout_root","ui_fixture"],"type":"object"},"guard_paths":{"additionalProperties":false,"properties":{"accepted_host_artifact":{"$ref":"#/$defs/path"},"attempt_root":{"$ref":"#/$defs/path"},"installed_tree":{"$ref":"#/$defs/path"},"virtual_store_tree":{"$ref":"#/$defs/path"}},"required":["accepted_host_artifact","attempt_root","installed_tree","virtual_store_tree"],"type":"object"},"production_manifest":{"$ref":"#/$defs/identity"},"public_configuration":{"$ref":"#/$defs/identity"},"runtime_private_schema":{"$ref":"#/$defs/identity"},"scenario_id":{"enum":["locked-refusal-v1","tree-timeout-v1","ui-success-v1"]},"schema_version":{"const":1},"source_revision":{"not":{"const":"0000000000000000000000000000000000000000"},"pattern":"^[0-9a-f]{40}$","type":"string"}},"required":["expected_identities","guard_paths","production_manifest","public_configuration","runtime_private_schema","scenario_id","schema_version","source_revision"],"type":"object"}
