{"expected_identities":{"controller":{"byte_count":1,"sha256":"2222222222222222222222222222222222222222222222222222222222222222"},"locked_preflight":{"byte_count":1,"sha256":"3333333333333333333333333333333333333333333333333333333333333333"},"supervisor":{"byte_count":1,"sha256":"4444444444444444444444444444444444444444444444444444444444444444"},"timeout_child":{"byte_count":1,"sha256":"5555555555555555555555555555555555555555555555555555555555555555"},"timeout_root":{"byte_count":1,"sha256":"6666666666666666666666666666666666666666666666666666666666666666"},"ui_fixture":{"byte_count":14336,"sha256":"f469671fd3d8f4986ced0448a70a023d225ed529802cee63cabb43f6fbca2ad6"}},"guard_paths":{"accepted_host_artifact":"C:\\stage2\\accepted-host.json","attempt_root":"C:\\stage2\\attempt","installed_tree":"C:\\stage2\\installed","virtual_store_tree":"C:\\stage2\\virtual-store"},"production_manifest":{"byte_count":1,"sha256":"1111111111111111111111111111111111111111111111111111111111111111"},"public_configuration":{"byte_count":1,"sha256":"8888888888888888888888888888888888888888888888888888888888888888"},"runtime_private_schema":{"byte_count":1,"sha256":"7777777777777777777777777777777777777777777777777777777777777777"},"scenario_id":"ui-success-v1","schema_version":1,"source_revision":"1111111111111111111111111111111111111111"}
